{"writeRequestId":"controlled_write_request_example_001","schemaVersion":"1.0.0","sandboxId":"sandbox_example_001","manifestRef":"C:/temp/kaveep-sandbox-example/sandbox-manifest.json","approvalLedgerRef":"C:/secure/kaveep-approval-ledger","reviewedChange":{"reviewedChangeId":"reviewed_change_example_001","schemaVersion":"1.0.0","reviewRequestRef":"reviewed_change_request_example_001","sandboxId":"sandbox_example_001","proposalRef":"engineering_proposal_example_001","loopResultRef":"engineering_loop_result_example_001","status":"ready_for_review","sourceSnapshotVerified":true,"changes":[],"patch":"","patchSha256":"aaaaaaaaaaaaaaaaaaaaaaaaaaaaaaaaaaaaaaaaaaaaaaaaaaaaaaaaaaaaaaaa","warnings":[],"errors":[],"limitations":["Review evidence only."],"requiresHumanApproval":true,"artifactAuthorizesSourceWrite":false,"createdAt":"2026-07-11T00:00:00.000Z","recommendedNextAction":"human_review"},"approvalVerification":{"verificationResultId":"change_approval_verification_example_001","schemaVersion":"1.0.0","reviewedChangeRef":"reviewed_change_example_001","patchSha256":"aaaaaaaaaaaaaaaaaaaaaaaaaaaaaaaaaaaaaaaaaaaaaaaaaaaaaaaaaaaaaaaa","approvalRequestRef":"approval_example_001","riskAssessmentRef":"risk_example_001","attestationRef":"change_review_attestation_example_001","status":"verified","decision":"eligible_for_revalidation","checks":["exact_patch_hash"],"consumed":true,"errors":[],"limitations":["Revalidate before write."],"verifiedAt":"2026-07-11T00:00:00.000Z","recommendedNextAction":"revalidate_before_write"},"protectedPaths":["ENGINEERING-CONSTITUTION.md"],"limits":{"maxChangedFiles":50,"maxFileBytes":1048576,"maxTotalWriteBytes":10485760,"maxPatchBytes":5242880,"maxDiffLines":20000},"status":"approved_for_single_write_attempt","createdAt":"2026-07-11T00:00:00.000Z"}
